"9XW4RF49","journalArticle","","Jansen, Peter; Côté, Marc-Alexandre; Khot, Tushar; Bransom, Erin; Mishra, Bhavana Dalvi; Majumder, Bodhisattwa Prasad; Tafjord, Oyvind; Clark, Peter","DISCOVERYWORLD: A Virtual Environment for Developing and Evaluating Automated Scientific Discovery Agents","","","","","","","","2025-03-30 16:23:59","2025-03-30 16:23:59","","","","","","","","","","","","","","","en","","","","","Zotero","","","","/Users/nikolajmosgaardsomod/Zotero/storage/TIPZAAXH/Jansen et al. - DISCOVERYWORLD A Virtual Environment for Developing and Evaluating Automated Scientific Discovery A.pdf","","","","","","","","","","","","","","","","","","","","","","","","","","","","","","","","","","","","","","","","","","","","","","","","",""
"IKFT77ZD","journalArticle","","Haresh, Sanjay; Dijkman, Daniel; Bhattacharyya, Apratim; Memisevic, Roland","ClevrSkills: Compositional Language and Visual Reasoning in Robotics","","","","","","Robotics tasks are highly compositional by nature. For example, to perform a high-level task like cleaning the table a robot must employ low-level capabilities of moving the effectors to the objects on the table, pick them up and then move them off the table one-by-one, while re-evaluating the consequently dynamic scenario in the process. Given that large vision language models (VLMs) have shown progress on many tasks that require high level, human-like reasoning, we ask the question: if the models are taught the requisite low-level capabilities, can they compose them in novel ways to achieve interesting high-level tasks like cleaning the table without having to be explicitly taught so? To this end, we present ClevrSkills - a benchmark suite for compositional reasoning in robotics. ClevrSkills is an environment suite developed on top of the ManiSkill2 [16] simulator and an accompanying dataset. The dataset contains trajectories generated on a range of robotics tasks with language and visual annotations as well as multi-modal prompts as task specification. The suite includes a curriculum of tasks with three levels of compositional understanding, starting with simple tasks requiring basic motor skills. We benchmark multiple different VLM baselines on ClevrSkills and show that even after being pre-trained on large numbers of tasks, these models fail on compositional reasoning in robotics tasks.","","2025-03-30 16:24:01","2025-03-30 16:24:01","","","","","","","","","","","","","","","en","","","","","Zotero","","","","/Users/nikolajmosgaardsomod/Zotero/storage/ECSD4RRS/Haresh et al. - ClevrSkills Compositional Language and Visual Reasoning in Robotics.pdf","","","","","","","","","","","","","","","","","","","","","","","","","","","","","","","","","","","","","","","","","","","","","","","","",""
"43WXZ2EG","preprint","2024","Peterson, Ralph E; Tanelus, Aramis; Ick, Christopher; Mimica, Bartul; Francis, Niegil; Ivan, Violet J; Choudhri, Aman; Falkner, Annegret L; Murthy, Mala; Schneider, David M; Sanes, Dan H; Williams, Alex H","Vocal Call Locator Benchmark (VCL) for localizing rodent vocalizations from multi-channel audio","","","","10.1101/2024.09.20.613758","http://biorxiv.org/lookup/doi/10.1101/2024.09.20.613758","Understanding the behavioral and neural dynamics of social interactions is a goal of contemporary neuroscience. Many machine learning methods have emerged in recent years to make sense of complex video and neurophysiological data that result from these experiments. Less focus has been placed on understanding how animals process acoustic information, including social vocalizations. A critical step to bridge this gap is determining the senders and receivers of acoustic information in social interactions. While sound source localization (SSL) is a classic problem in signal processing, existing approaches are limited in their ability to localize animal-generated sounds in standard laboratory environments. Advances in deep learning methods for SSL are likely to help address these limitations, however there are currently no publicly available models, datasets, or benchmarks to systematically evaluate SSL algorithms in the domain of bioacoustics. Here, we present the VCL Benchmark: the ﬁrst large-scale dataset for benchmarking SSL algorithms in rodents. We acquired synchronized video and multi-channel audio recordings of 767,295 sounds with annotated ground truth sources across 9 conditions. The dataset provides benchmarks which evaluate SSL performance on real data, simulated acoustic data, and a mixture of real and simulated data. We intend for this benchmark to facilitate knowledge transfer between the neuroscience and acoustic machine learning communities, which have had limited overlap.","2024-09-21","2025-03-30 16:24:03","2025-03-30 16:24:03","2025-03-30 16:24:03","","","","","","","","","","","","","","en","http://creativecommons.org/licenses/by/4.0/","","","","Neuroscience","","","","/Users/nikolajmosgaardsomod/Zotero/storage/JLLQPGMU/Peterson et al. - 2024 - Vocal Call Locator Benchmark (VCL) for localizing rodent vocalizations from multi-channel audio.pdf","","","","","","","","","","","","","","","","","","","","","","","","","","","","","","","","","","","","","","","","","","","","","","","","",""
"FPTAM2Z4","journalArticle","","Kazemi, Mehran; Dikkala, Nishanth; Anand, Ankit; Devic, Petar; Dasgupta, Ishita; Liu, Fangyu; Fatemi, Bahare; Awasthi, Pranjal; Guo, Dee; Gollapudi, Sreenivas; Qureshi, Ahmed","ReMI: A Dataset for Reasoning with Multiple Images","","","","","","With the continuous advancement of large language models (LLMs), it is essential to create new benchmarks to effectively evaluate their expanding capabilities and identify areas for improvement. This work focuses on multi-image reasoning, an emerging capability in state-of-the-art LLMs. We introduce ReMI, a dataset designed to assess LLMs’ ability to Reason with Multiple Images. This dataset encompasses a diverse range of tasks, spanning various reasoning domains such as math, physics, logic, code, table/chart understanding, and spatial and temporal reasoning. It also covers a broad spectrum of characteristics found in multi-image reasoning scenarios. We have benchmarked several cutting-edge LLMs using ReMI and found a substantial gap between their performance and human-level proﬁciency. This highlights the challenges in multi-image reasoning and the need for further research. Our analysis also reveals the strengths and weaknesses of different models, shedding light on the types of reasoning that are currently attainable and areas where future models require improvement. To foster further research in this area, we are open-sourcing ReMI: https://huggingface.co/datasets/ mehrankazemi/ReMI.","","2025-03-30 16:24:04","2025-03-30 16:24:04","","","","","","","","","","","","","","","en","","","","","Zotero","","","","/Users/nikolajmosgaardsomod/Zotero/storage/F3XGAIKK/Kazemi et al. - ReMI A Dataset for Reasoning with Multiple Images.pdf","","","","","","","","","","","","","","","","","","","","","","","","","","","","","","","","","","","","","","","","","","","","","","","","",""
"VP443UBI","journalArticle","","Turishcheva, Polina; Fahey, Paul G; Vystrcˇilová, Michaela; Hansel, Laura; Froebe, Rachel; Ponder, Kayla; Qiu, Yongrong; Willeke, Konstantin F; Bashiri, Mohammad; Baikulov, Ruslan; Zhu, Yu; Ma, Lei; Yu, Shan; Huang, Tiejun; Li, Bryan M; Wulf, Wolf De; Kudryashova, Nina; Hennig, Matthias H; Rochefort, Nathalie L; Onken, Arno; Wang, Eric; Ding, Zhiwei; Tolias, Andreas S; Sinz, Fabian H; Ecker, Alexander S","Retrospective for the Dynamic Sensorium Competition for predicting large-scale mouse primary visual cortex activity from videos","","","","","","Understanding how biological visual systems process information is challenging because of the nonlinear relationship between visual input and neuronal responses. Artiﬁcial neural networks allow computational neuroscientists to create predictive models that connect biological and machine vision. Machine learning has beneﬁted tremendously from benchmarks that compare different models on the same task under standardized conditions. However, there was no standardized benchmark to identify state-of-the-art dynamic models of the mouse visual system. To address this gap, we established the SENSORIUM 2023 Benchmark Competition with dynamic input, featuring a new large-scale dataset from the primary visual cortex of ten mice. This dataset includes responses from 78,853 neurons to 2 hours of dynamic stimuli per neuron, together with behavioral measurements such as running speed, pupil dilation, and eye movements. The competition ranked models in two tracks based on predictive performance for neuronal responses on a held-out test set: one focusing on predicting in-domain natural stimuli and another on out-of-distribution (OOD) stimuli to assess model generalization. As part of the NeurIPS 2023 Competition Track, we received more than 160 model submissions from 22 teams. Several new architectures for predictive models were proposed, and the winning teams improved the previous state-of-the-art model by 50%. Access to the dataset as well as the benchmarking infrastructure will remain online at www.sensorium-competition.net.","","2025-03-30 16:24:05","2025-03-30 16:24:06","","","","","","","","","","","","","","","en","","","","","Zotero","","","","/Users/nikolajmosgaardsomod/Zotero/storage/YBHZ4NPX/Turishcheva et al. - Retrospective for the Dynamic Sensorium Competition for predicting large-scale mouse primary visual.pdf","","","","","","","","","","","","","","","","","","","","","","","","","","","","","","","","","","","","","","","","","","","","","","","","",""
"M3NQX3ZJ","journalArticle","","Akhbari, Bardiya; Gawali, Manish; Dronen, Nicholas A","SETLEXSEM CHALLENGE: Using Set Operations to Evaluate the Lexical and Semantic Robustness of Language Models","","","","","","Set theory is foundational to mathematics and, when sets are finite, to reasoning about the world. An intelligent system should perform set operations consistently, regardless of superficial variations in the operands. Initially designed for semantically-oriented NLP tasks, large language models (LLMs) are now being evaluated on algorithmic tasks. Because sets are comprised of arbitrary symbols (e.g. numbers, words), they provide an opportunity to test, systematically, the invariance of LLMs’ algorithmic abilities under simple lexical or semantic variations. To this end, we present the SETLEXSEM CHALLENGE, a synthetic benchmark that evaluates the performance of LLMs on set operations. SETLEXSEM assesses the robustness of LLMs’ instruction-following abilities under various conditions, focusing on the set operations and the nature and construction of the set members. Evaluating seven LLMs with SETLEXSEM, we find that they exhibit poor robustness to variation in both operation and operands. We show – via the framework’s systematic sampling of set members along lexical and semantic dimensions – that LLMs are not only not robust to variation along these dimensions but demonstrate unique failure modes in particular, easy-to-create semantic groupings of ""deceptive"" sets. We find that rigorously measuring language model robustness to variation in frequency and length is challenging and present an analysis that measures them independently. The code for reproducing the results of this paper, and for generating the SETLEXSEM CHALLENGE dataset, is available at https://github.com/amazon-science/SetLexSem-Challenge.","","2025-03-30 16:24:07","2025-03-30 16:24:07","","","","","","","","","","","","","","","en","","","","","Zotero","","","","/Users/nikolajmosgaardsomod/Zotero/storage/MJJ55Z5V/Akhbari et al. - SETLEXSEM CHALLENGE Using Set Operations to Evaluate the Lexical and Semantic Robustness of Languag.pdf","","","","","","","","","","","","","","","","","","","","","","","","","","","","","","","","","","","","","","","","","","","","","","","","",""
"M5VH8EBM","journalArticle","","Wang, Yuli; Peng, Jian; Dai, Yuwei; Jones, Craig; Sair, Haris; Shen, Jinglai; Loizou, Nicolas; Wu, Jing; Hsu, Wen-Chi; Imami, Maliha; Jiao, Zhicheng; Zhang, Paul; Bai, Harrison","Enhancing vision-language models for medical imaging: bridging the 3D gap with innovative slice selection","","","","","","Recent approaches to vision-language tasks are built on the remarkable capabilities of large vision-language models (VLMs). These models excel in zero-shot and few-shot learning, enabling them to learn new tasks without parameter updates. However, their primary challenge lies in their design, which primarily accommodates 2D input, thus limiting their effectiveness for medical images, particularly radiological images like MRI and CT, which are typically 3D. To bridge the gap between state-of-the-art 2D VLMs and 3D medical image data, we developed an innovative, one-pass, unsupervised representative slice selection method called Vote-MI, which selects representative 2D slices from 3D medical imaging. To evaluate the effectiveness of Vote-MI when implemented with VLMs, we introduce BrainMD, a robust, multimodal dataset comprising 2,453 annotated 3D MRI brain scans with corresponding textual radiology reports and electronic health records. Based on BrainMD, we further develop two benchmarks, BrainMD-select (including the most representative 2D slice of a 3D image) and BrainBench (including various vision-language downstream tasks). Extensive experiments on the BrainMD dataset and its two corresponding benchmarks demonstrate that our representative selection method signiﬁcantly improves performance in zero-shot and few-shot learning tasks. On average, Vote-MI achieves a 14.6% and 16.6% absolute gain for zero-shot and few-shot learning, respectively, compared to randomly selecting examples. Our studies represent a signiﬁcant step toward integrating AI in medical imaging to enhance patient care and facilitate medical research. We hope this work will serve as a foundation for data selection as vision-language models are increasingly applied to new tasks. Code and data examples are available at Github: https://github.com/YuliWanghust/BrainMD.","","2025-03-30 16:24:08","2025-03-30 16:24:08","","","","","","","","","","","","","","","en","","","","","Zotero","","","","/Users/nikolajmosgaardsomod/Zotero/storage/B4K7J8E3/Wang et al. - Enhancing vision-language models for medical imaging bridging the 3D gap with innovative slice sele.pdf","","","","","","","","","","","","","","","","","","","","","","","","","","","","","","","","","","","","","","","","","","","","","","","","",""
"RSJHHCE3","journalArticle","","Shah, Nidhish; Genc, Zulkuf; Araci, Dogu","StackEval: Benchmarking LLMs in Coding Assistance","","","","","","We present two comprehensive benchmarks to evaluate the performance of language models in coding assistance tasks, covering code writing, debugging, code review, and conceptual understanding. Our main contribution includes two curated datasets: StackEval, a large-scale benchmark derived from Stack Overflow questions, and StackUnseen, a dynamic benchmark featuring the most recent Stack Overflow content. These benchmarks offer novel insights into the capabilities and limitations of LLMs, particularly in handling new and emerging content. Additionally, we assess LLMs’ proficiency as judges for coding tasks using a curated, human-annotated dataset, exploring their evaluation capabilities and potential biases, including whether they favor their own generated solutions. Our findings underscore the potential of these benchmarks to advance LLM development and application in coding assistance. To ensure reproducibility, we publicly share our datasets and evaluation code at https://github.com/ProsusAI/stack-eval.","","2025-03-30 16:24:09","2025-03-30 16:24:09","","","","","","","","","","","","","","","en","","","","","Zotero","","","","/Users/nikolajmosgaardsomod/Zotero/storage/VDNB6IK4/Shah et al. - StackEval Benchmarking LLMs in Coding Assistance.pdf","","","","","","","","","","","","","","","","","","","","","","","","","","","","","","","","","","","","","","","","","","","","","","","","",""
"KVGQK4R2","journalArticle","","Antonov, Anton; Moskalenko, Andrey; Shepelev, Denis; Krapukhin, Alexander; Soshin, Konstantin; Konushin, Anton; Shakhuro, Vlad","RClicks: Realistic Click Simulation for Benchmarking Interactive Segmentation","","","","","","The emergence of Segment Anything (SAM) sparked research interest in the field of interactive segmentation, especially in the context of image editing tasks and speeding up data annotation. Unlike common semantic segmentation, interactive segmentation methods allow users to directly influence their output through prompts (e.g. clicks). However, click patterns in real-world interactive segmentation scenarios remain largely unexplored. Most methods rely on the assumption that users would click in the center of the largest erroneous area. Nevertheless, recent studies show that this is not always the case. Thus, methods may have poor performance in real-world deployment despite high metrics in a baseline benchmark. To accurately simulate real-user clicks, we conducted a large crowdsourcing study of click patterns in an interactive segmentation scenario and collected 475K real-user clicks. Drawing on ideas from saliency tasks, we develop a clickability model that enables sampling clicks, which closely resemble actual user inputs. Using our model and dataset, we propose RClicks benchmark for a comprehensive comparison of existing interactive segmentation methods on realistic clicks. Specifically, we evaluate not only the average quality of methods, but also the robustness w.r.t. click patterns. According to our benchmark, in real-world usage interactive segmentation models may perform worse than it has been reported in the baseline benchmark, and most of the methods are not robust. We believe that RClicks is a significant step towards creating interactive segmentation methods that provide the best user experience in real-world cases.","","2025-03-30 16:24:11","2025-03-30 16:24:11","","","","","","","","","","","","","","","en","","","","","Zotero","","","","/Users/nikolajmosgaardsomod/Zotero/storage/K4VKFFMH/Antonov et al. - RClicks Realistic Click Simulation for Benchmarking Interactive Segmentation.pdf","","","","","","","","","","","","","","","","","","","","","","","","","","","","","","","","","","","","","","","","","","","","","","","","",""
"FLFQ8G5A","journalArticle","","Coursey, Austin; Ji, Junyi; Quinones-Grueiro, Marcos; Barbour, William; Zhang, Yuhang; Derr, Tyler; Biswas, Gautam; Work, Daniel B","FT-AED: Benchmark Dataset for Early Freeway Traffic Anomalous Event Detection","","","","","","Early and accurate detection of anomalous events on the freeway, such as accidents, can improve emergency response and clearance. However, existing delays and mistakes from manual crash reporting records make it a difficult problem to solve. Current large-scale freeway traffic datasets are not designed for anomaly detection and ignore these challenges. In this paper, we introduce the first large-scale lanelevel freeway traffic dataset for anomaly detection. Our dataset consists of a month of weekday radar detection sensor data collected in 4 lanes along an 18-mile stretch of Interstate 24 heading toward Nashville, TN, comprising over 3.7 million sensor measurements. We also collect official crash reports from the Tennessee Department of Transportation Traffic Management Center and manually label all other potential anomalies in the dataset. To show the potential for our dataset to be used in future machine learning and traffic research, we benchmark numerous deep learning anomaly detection models on our dataset. We find that unsupervised graph neural network autoencoders are a promising solution for this problem and that ignoring spatial relationships leads to decreased performance. We demonstrate that our methods can reduce reporting delays by over 10 minutes on average while detecting 75% of crashes. Our dataset and all preprocessing code needed to get started are publicly released at https://vu.edu/ft-aed/ to facilitate future research.","","2025-03-30 16:24:12","2025-03-30 16:24:12","","","","","","","","","","","","","","","en","","","","","Zotero","","","","/Users/nikolajmosgaardsomod/Zotero/storage/SS2SG8TI/Coursey et al. - FT-AED Benchmark Dataset for Early Freeway Traffic Anomalous Event Detection.pdf","","","","","","","","","","","","","","","","","","","","","","","","","","","","","","","","","","","","","","","","","","","","","","","","",""
"F5FU3269","preprint","2024","Silberg, Jake; Swanson, Kyle; Simon, Elana; Zhang, Angela; Ghazizadeh, Zaniar; Ogden, Scott; Hamadeh, Hisham; Zou, James","UniTox: Leveraging LLMs to Curate a Unified Dataset of Drug-Induced Toxicity from FDA Labels","","","","10.1101/2024.06.21.24309315","http://medrxiv.org/lookup/doi/10.1101/2024.06.21.24309315","Drug-induced toxicity is one of the leading reasons new drugs fail clinical trials. Machine learning models that predict drug toxicity from molecular structure could help researchers prioritize less toxic drug candidates. However, current toxicity datasets are typically small and limited to a single organ system (e.g., cardio, renal, or liver). Creating these datasets often involved time-intensive expert curation by parsing drug labelling documents that can exceed 100 pages per drug. Here, we introduce UniTox1, a unified dataset of 2,418 FDA-approved drugs with druginduced toxicity summaries and ratings created by using GPT-4o to process FDA drug labels. UniTox spans eight types of toxicity: cardiotoxicity, liver toxicity, renal toxicity, pulmonary toxicity, hematological toxicity, dermatological toxicity, ototoxicity, and infertility. This is, to the best of our knowledge, the largest such systematic human in vivo database by number of drugs and toxicities, and the first covering nearly all non-combination FDA-approved medications for several of these toxicities. We recruited clinicians to validate a random sample of our GPT-4o annotated toxicities, and UniTox’s toxicity ratings concord with clinician labelers 85–96% of the time. Finally, we benchmark several machine learning models trained on UniTox to demonstrate the utility of this dataset for building molecular toxicity prediction models.","2024-06-22","2025-03-30 16:24:15","2025-03-30 16:24:15","2025-03-30 16:24:15","","","","","","","UniTox","","","","","","","en","","","","","Health Informatics","","","","/Users/nikolajmosgaardsomod/Zotero/storage/DDM6SDXG/Silberg et al. - 2024 - UniTox Leveraging LLMs to Curate a Unified Dataset of Drug-Induced Toxicity from FDA Labels.pdf","","","","","","","","","","","","","","","","","","","","","","","","","","","","","","","","","","","","","","","","","","","","","","","","",""
"YFY4TN4I","journalArticle","","Oh, Jio; Kim, Soyeon; Seo, Junseok; Wang, Jindong; Xu, Ruochen; Xie, Xing; Whang, Steven Euijong","ERBench: An Entity-Relationship based Automatically Verifiable Hallucination Benchmark for Large Language Models","","","","","","Large language models (LLMs) have achieved unprecedented performances in various applications, yet evaluating them is still challenging. Existing benchmarks are either manually constructed or are automatic, but lack the ability to evaluate the thought process of LLMs with arbitrary complexity. We contend that utilizing existing relational databases based on the entity-relationship (ER) model is a promising approach for constructing benchmarks as they contain structured knowledge that can be used to question LLMs. Unlike knowledge graphs, which are also used to evaluate LLMs, relational databases have integrity constraints that can be used to better construct complex in-depth questions and verify answers: (1) functional dependencies can be used to pinpoint critical keywords that an LLM must know to properly answer a given question containing certain attribute values; and (2) foreign key constraints can be used to join relations and construct multi-hop questions, which can be arbitrarily long and used to debug intermediate answers. We thus propose ERBench, which uses these integrity constraints to convert any database into an LLM benchmark. ERBench supports continuous evaluation as databases change, multimodal questions, and various prompt engineering techniques. In our experiments, we construct LLM benchmarks using databases of multiple domains and make an extensive comparison of contemporary LLMs. We show how ERBench can properly evaluate any LLM by not only checking for answer correctness, but also effectively verifying the rationales by looking for the right keywords.","","2025-03-30 16:24:17","2025-03-30 16:24:17","","","","","","","","","","","","","","","en","","","","","Zotero","","","","/Users/nikolajmosgaardsomod/Zotero/storage/GXFKNCLW/Oh et al. - ERBench An Entity-Relationship based Automatically Verifiable Hallucination Benchmark for Large Lan.pdf","","","","","","","","","","","","","","","","","","","","","","","","","","","","","","","","","","","","","","","","","","","","","","","","",""
