"LRSCBFI6","journalArticle","","Myung, Junho; Lee, Nayeon; Zhou, Yi; Jin, Jiho; Putri, Rifki Afina; Antypas, Dimosthenis; Borkakoty, Hsuvas; Kim, Eunsu; Perez-Almendros, Carla; Ayele, Abinew Ali; Gutiérrez-Basulto, Víctor; Ibáñez-García, Yazmín; Lee, Hwaran; Muhammad, Shamsuddeen Hassan; Park, Kiwoong; Rzayev, Anar Sabuhi; White, Nina; Yimam, Seid Muhie; Pilehvar, Mohammad Taher; Ousidhoum, Nedjma; Camacho-Collados, Jose; Oh, Alice","BLEND: A Benchmark for LLMs on Everyday Knowledge in Diverse Cultures and Languages","","","","","","Large language models (LLMs) often lack culture-specific knowledge of daily life, especially across diverse regions and non-English languages. Existing benchmarks for evaluating LLMs’ cultural sensitivities are limited to a single language or collected from online sources such as Wikipedia, which do not reflect the mundane everyday lifestyles of diverse regions. That is, information about the food people eat for their birthday celebrations, spices they typically use, musical instruments youngsters play, or the sports they practice in school is common cultural knowledge but uncommon in easily collected online sources, especially for underrepresented cultures. To address this issue, we introduce BLEND, a hand-crafted benchmark designed to evaluate LLMs’ everyday knowledge across diverse cultures and languages. BLEND comprises 52.6k question-answer pairs from 16 countries/regions, in 13 different languages, including low-resource ones such as Amharic, Assamese, Azerbaijani, Hausa, and Sundanese. We construct the benchmark to include two formats of questions: short-answer and multiple-choice. We show that LLMs perform better for cultures that are highly represented online, with a maximum 57.34% difference in GPT-4, the best-performing model, in the short-answer format. For cultures represented by mid-to-high-resource languages, LLMs perform better in their local languages, but for cultures represented by low-resource languages, LLMs perform better in English than the local languages. We make our dataset publicly available at: https://github.com/nlee0212/BLEnD.","","2025-03-30 16:29:15","2025-03-30 16:29:15","","","","","","","","","","","","","","","en","","","","","Zotero","","","","/Users/nikolajmosgaardsomod/Zotero/storage/PMH79RHW/Myung et al. - BLEND A Benchmark for LLMs on Everyday Knowledge in Diverse Cultures and Languages.pdf","","","","","","","","","","","","","","","","","","","","","","","","","","","","","","","","","","","","","","","","","","","","","","","","",""
"YTDXACA2","journalArticle","","Kwon, Yeonsu; Kim, Jiho; Lee, Gyubok; Bae, Seongsu; Kyung, Daeun; Cha, Wonchul; Pollard, Tom; Johnson, Alistair; Choi, Edward","EHRCon: Dataset for Checking Consistency between Unstructured Notes and Structured Tables in Electronic Health Records","","","","","","Electronic Health Records (EHRs) are integral for storing comprehensive patient medical records, combining structured data (e.g., medications) with detailed clinical notes (e.g., physician notes). These elements are essential for straightforward data retrieval and provide deep, contextual insights into patient care. However, they often suffer from discrepancies due to unintuitive EHR system designs and human errors, posing serious risks to patient safety. To address this, we developed EHRCon, a new dataset and task specifically designed to ensure data consistency between structured tables and unstructured notes in EHRs. EHRCon was crafted in collaboration with healthcare professionals using the MIMIC-III EHR dataset, and includes manual annotations of 4,101 entities across 105 clinical notes checked against database entries for consistency. EHRCon has two versions, one using the original MIMICIII schema, and another using the OMOP CDM schema, in order to increase its applicability and generalizability. Furthermore, leveraging the capabilities of large language models, we introduce CheckEHR, a novel framework for verifying the consistency between clinical notes and database tables. CheckEHR utilizes an eight-stage process and shows promising results in both few-shot and zero-shot settings. The code is available at https://github.com/dustn1259/EHRCon.","","2025-03-30 16:29:16","2025-03-30 16:29:16","","","","","","","","","","","","","","","en","","","","","Zotero","","","","/Users/nikolajmosgaardsomod/Zotero/storage/SEZB946K/Kwon et al. - EHRCon Dataset for Checking Consistency between Unstructured Notes and Structured Tables in Electro.pdf","","","","","","","","","","","","","","","","","","","","","","","","","","","","","","","","","","","","","","","","","","","","","","","","",""
"VKRVFWUE","journalArticle","","Hu, Jiamian; Hong, Yuanyuan; Chen, Yihua; Wang, He; Yasuhara, Moriaki","Noisy Ostracods: A Fine-Grained, Imbalanced Real-World Dataset for Benchmarking Robust Machine Learning and Label Correction Methods","","","","","","We present the Noisy Ostracods, a noisy dataset for genus and species classification of crustacean ostracods with specialists’ annotations. Over the 71466 specimens collected, 5.58% of them are estimated to be noisy (possibly problematic) at genus level. The dataset is created to addressing a real-world challenge: creating a clean fine-grained taxonomy dataset. The Noisy Ostracods dataset has diverse noises from multiple sources. Firstly, the noise is open-set, including new classes discovered during curation that were not part of the original annotation. The dataset has pseudo-classes, where annotators misclassified samples that should belong to an existing class into a new pseudo-class. The Noisy Ostracods dataset is highly imbalanced with a imbalance factor ρ = 22429. This presents a unique challenge for robust machine learning methods, as existing approaches have not been extensively evaluated on fine-grained classification tasks with such diverse real-world noise. Initial experiments using current robust learning techniques have not yielded significant performance improvements on the Noisy Ostracods dataset compared to cross-entropy training on the raw, noisy data. On the other hand, noise detection methods have underperformed in error hit rate compared to naive cross-validation ensembling for identifying problematic labels. These findings suggest that the fine-grained, imbalanced nature, and complex noise characteristics of the dataset present considerable challenges for existing noiserobust algorithms. By openly releasing the Noisy Ostracods dataset, our goal is to encourage further research into the development of noise-resilient machine learning methods capable of effectively handling diverse, real-world noise in finegrained classification tasks. The dataset, along with its evaluation protocols, can be accessed at https://github.com/H-Jamieu/Noisy_ostracods.","","2025-03-30 16:29:18","2025-03-30 16:29:18","","","","","","","","","","","","","","","en","","","","","Zotero","","","","/Users/nikolajmosgaardsomod/Zotero/storage/SQXZB92Y/Hu et al. - Noisy Ostracods A Fine-Grained, Imbalanced Real-World Dataset for Benchmarking Robust Machine Learn.pdf","","","","","","","","","","","","","","","","","","","","","","","","","","","","","","","","","","","","","","","","","","","","","","","","",""
"53RT2LG2","journalArticle","","Udandarao, Vishaal; Roth, Karsten; Dziadzio, Sebastian; Prabhu, Ameya; Cherti, Mehdi; Vinyals, Oriol; Hénaff, Olivier; Albanie, Samuel; Akata, Zeynep; Bethge, Matthias","A Practitioner’s Guide to Continual Multimodal Pretraining","","","","","","Multimodal foundation models serve numerous applications at the intersection of vision and language. Still, despite being pretrained on extensive data, they become outdated over time. To keep models updated, research into continual pretraining mainly explores scenarios with either (1) infrequent, indiscriminate updates on large-scale new data, or (2) frequent, sample-level updates. However, practical model deployment often operates in the gap between these two limit cases, as real-world applications demand adaptation to specific subdomains, tasks or concepts — spread over the entire, varying life cycle of a model. In this work, we complement current perspectives on continual pretraining through a research test bed and offer comprehensive guidance for effective continual model updates in such scenarios. We first introduce FoMo-in-Flux, a continual multimodal pretraining benchmark with realistic compute constraints and practical deployment requirements, constructed over 63 datasets with diverse visual and semantic coverage. Using FoMo-in-Flux, we explore the complex landscape of practical continual pretraining through multiple perspectives: (1) data mixtures and stream orderings that emulate real-world deployment settings, (2) methods ranging from simple fine-tuning and traditional continual learning strategies to parameter-efficient updates and model merging, (3) meta-learning-rate schedules and mechanistic design choices, and (4) model and compute scaling. Together, our insights provide a practitioner’s guide to continual multimodal pretraining for real-world deployment. Benchmark and code is provided here: github.com/ExplainableML/fomo_in_flux.","","2025-03-30 16:29:19","2025-03-30 16:29:19","","","","","","","","","","","","","","","en","","","","","Zotero","","","","/Users/nikolajmosgaardsomod/Zotero/storage/SFBPKH8G/Udandarao et al. - A Practitioner’s Guide to Continual Multimodal Pretraining.pdf","","","","","","","","","","","","","","","","","","","","","","","","","","","","","","","","","","","","","","","","","","","","","","","","",""
"F742HUXT","journalArticle","","Rutherford, Alexander; Ellis, Benjamin; Gallici, Matteo; Cook, Jonathan; Lupu, Andrei; Ingvarsson, Garðar; Willi, Timon; Hammond, Ravi; Khan, Akbir; de Witt, Christian Schroeder; Souly, Alexandra; Bandyopadhyay, Saptarashmi; Samvelyan, Mikayel; Jiang, Minqi; Lange, Robert; Whiteson, Shimon; Lacerda, Bruno; Hawes, Nick; Rocktäschel, Tim; Lu, Chris; Foerster, Jakob","JaxMARL: Multi-Agent RL Environments and Algorithms in JAX","","","","","","Benchmarks are crucial in the development of machine learning algorithms, with available environments significantly influencing reinforcement learning (RL) research. Traditionally, RL environments run on the CPU, which limits their scalability with typical academic compute. However, recent advancements in JAX have enabled the wider use of hardware acceleration, enabling massively parallel RL training pipelines and environments. While this has been successfully applied to single-agent RL, it has not yet been widely adopted for multi-agent scenarios. In this paper, we present JaxMARL, the first open-source, Python-based library that combines GPU-enabled efficiency with support for a large number of commonly used MARL environments and popular baseline algorithms. Our experiments show that, in terms of wall clock time, our JAX-based training pipeline is around 14 times faster than existing approaches, and up to 12500x when multiple training runs are vectorized. This enables efficient and thorough evaluations, potentially alleviating the evaluation crisis in the field. We also introduce and benchmark SMAX, a JAXbased approximate reimplementation of the popular StarCraft Multi-Agent Challenge, which removes the need to run the StarCraft II game engine. This not only enables GPU acceleration, but also provides a more flexible MARL environment, unlocking the potential for self-play, meta-learning, and other future applications in MARL. The code is available at https://github.com/flairox/jaxmarl.","","2025-03-30 16:29:20","2025-03-30 16:29:20","","","","","","","","","","","","","","","en","","","","","Zotero","","","","/Users/nikolajmosgaardsomod/Zotero/storage/XGWHS4XC/Rutherford et al. - JaxMARL Multi-Agent RL Environments and Algorithms in JAX.pdf","","","","","","","","","","","","","","","","","","","","","","","","","","","","","","","","","","","","","","","","","","","","","","","","",""
"C85Q459D","journalArticle","","Ma, Yubo; Zang, Yuhang; Chen, Liangyu; Chen, Meiqi; Jiao, Yizhu; Li, Xinze; Lu, Xinyuan; Liu, Ziyu; Ma, Yan; Dong, Xiaoyi; Zhang, Pan; Pan, Liangming; Jiang, Yu-Gang; Wang, Jiaqi; Cao, Yixin; Sun, Aixin","MMLONGBENCH-DOC: Benchmarking Long-context Document Understanding with Visualizations","","","","","","Understanding documents with rich layouts and multi-modal components is a long-standing and practical task. Recent Large Vision-Language Models (LVLMs) have made remarkable strides in various tasks, particularly in single-page document understanding (DU). However, their abilities on long-context DU remain an open problem. This work presents MMLONGBENCH-DOC, a long-context, multimodal benchmark comprising 1,082 expert-annotated questions. Distinct from previous datasets, it is constructed upon 135 lengthy PDF-formatted documents with an average of 47.5 pages and 21,214 textual tokens. Towards comprehensive evaluation, answers to these questions rely on pieces of evidence from (1) different sources (text, image, chart, table, and layout structure) and (2) various locations (i.e., page number). Moreover, 33.7% of the questions are cross-page questions requiring evidence across multiple pages. 20.6% of the questions are designed to be unanswerable for detecting potential hallucinations. Experiments on 14 LVLMs demonstrate that long-context DU greatly challenges current models. Notably, the best-performing model, GPT-4o, achieves an F1 score of only 44.9%, while the second-best, GPT-4V, scores 30.5%. Furthermore, 12 LVLMs (all except GPT-4o and GPT-4V) even present worse performance than their LLM counterparts which are fed with lossy-parsed OCR documents. These results validate the necessity of future research toward more capable long-context LVLMs.","","2025-03-30 16:29:22","2025-03-30 16:29:22","","","","","","","","","","","","","","","en","","","","","Zotero","","","","/Users/nikolajmosgaardsomod/Zotero/storage/6TU99IRJ/Ma et al. - MMLONGBENCH-DOC Benchmarking Long-context Document Understanding with Visualizations.pdf","","","","","","","","","","","","","","","","","","","","","","","","","","","","","","","","","","","","","","","","","","","","","","","","",""
"WPP4Z3IV","journalArticle","","Boisvert, Léo; Thakkar, Megh; Gasse, Maxime; Caccia, Massimo","WorkArena++: Towards Compositional Planning and Reasoning-based Common Knowledge Work Tasks","","","","","","The ability of large language models (LLMs) to mimic human-like intelligence has led to a surge in LLM-based autonomous agents. Though recent LLMs seem capable of planning and reasoning given user instructions, their effectiveness in applying these capabilities for autonomous task solving remains underexplored. This is especially true in enterprise settings, where automated agents hold the promise of a high impact. To fill this gap, we propose WorkArena++, a novel benchmark consisting of 682 tasks corresponding to realistic workflows routinely performed by knowledge workers. WorkArena++ is designed to evaluate the planning, problem-solving, logical/arithmetic reasoning, retrieval, and contextual understanding abilities of web agents. Our empirical studies across state-of-the-art LLMs and vision-language models (VLMs), as well as human workers, reveal several challenges for such models to serve as useful assistants in the workplace. In addition to the benchmark, we provide a mechanism to effortlessly generate thousands of ground-truth observation/action traces, which can be used for fine-tuning existing models. Overall, we expect this work to serve as a useful resource to help the community progress toward capable autonomous agents. The benchmark can be found at https://github.com/ServiceNow/WorkArena.","","2025-03-30 16:29:23","2025-03-30 16:29:23","","","","","","","","","","","","","","","en","","","","","Zotero","","","","/Users/nikolajmosgaardsomod/Zotero/storage/BLPGLYP5/Boisvert et al. - WorkArena++ Towards Compositional Planning and Reasoning-based Common Knowledge Work Tasks.pdf","","","","","","","","","","","","","","","","","","","","","","","","","","","","","","","","","","","","","","","","","","","","","","","","",""
"ZFRK2BDI","journalArticle","","Hua, Chenqing; Zhong, Bozitao; Luan, Sitao; Hong, Liang; Wolf, Guy; Precup, Doina; Zheng, Shuangjia","ReactZyme: A Benchmark for Enzyme-Reaction Prediction","","","","","","Enzymes, with their specific catalyzed reactions, are necessary for all aspects of life, enabling diverse biological processes and adaptations. Predicting enzyme functions is essential for understanding biological pathways, guiding drug development, enhancing bioproduct yields, and facilitating evolutionary studies. Addressing the inherent complexities, we introduce a new approach to annotating enzymes based on their catalyzed reactions. This method provides detailed insights into specific reactions and is adaptable to newly discovered reactions, diverging from traditional classifications by protein family or expert-derived reaction classes. We employ machine learning algorithms to analyze enzyme reaction datasets, delivering a much more refined view on the functionality of enzymes. Our evaluation leverages the largest enzyme-reaction dataset to date, derived from the SwissProt and Rhea databases with entries up to January 8, 2024. We frame the enzyme-reaction prediction as a retrieval problem, aiming to rank enzymes by their catalytic ability for specific reactions. With our model, we can recruit proteins for novel reactions and predict reactions in novel proteins, facilitating enzyme discovery and function annotation (https://github.com/WillHua127/ReactZyme).","","2025-03-30 16:29:25","2025-03-30 16:29:25","","","","","","","","","","","","","","","en","","","","","Zotero","","","","/Users/nikolajmosgaardsomod/Zotero/storage/XT2MCHYL/Hua et al. - ReactZyme A Benchmark for Enzyme-Reaction Prediction.pdf","","","","","","","","","","","","","","","","","","","","","","","","","","","","","","","","","","","","","","","","","","","","","","","","",""
"3TLEI6DD","journalArticle","","Jignasu, Anushrut; Marshall, Kelly O; Mishra, Ankush Kumar; Rillo, Lucas Nerone; Ganapathysubramanian, Baskar; Balu, Aditya; Hegde, Chinmay; Krishnamurthy, Adarsh","Slice-100K: A Multimodal Dataset for Extrusion-based 3D Printing","","","","","","G-code (Geometric code) or RS-274 is the most widely used computer numerical control (CNC) and 3D printing programming language. G-code provides machine instructions for the movement of the 3D printer, especially for the nozzle, stage, and extrusion of material for extrusion-based additive manufacturing. Currently, there does not exist a large repository of curated CAD models along with their corresponding G-code files for additive manufacturing. To address this issue, we present Slice-100K, a first-of-its-kind dataset of over 100,000 G-code files, along with their tessellated CAD model, LVIS (Large Vocabulary Instance Segmentation) categories, geometric properties, and renderings. We build our dataset from triangulated meshes derived from Objaverse-XL and Thingi10K datasets. We demonstrate the utility of this dataset by finetuning GPT-2 on a subset of the dataset for G-code translation from a legacy G-code format (Sailfish) to a more modern, widely used format (Marlin). Our dataset can be found here. Slice-100K will be the first step in developing a multimodal foundation model for digital manufacturing.","","2025-03-30 16:29:26","2025-03-30 16:29:26","","","","","","","","","","","","","","","en","","","","","Zotero","","","","/Users/nikolajmosgaardsomod/Zotero/storage/7ENL49VQ/Jignasu et al. - Slice-100K A Multimodal Dataset for Extrusion-based 3D Printing.pdf","","","","","","","","","","","","","","","","","","","","","","","","","","","","","","","","","","","","","","","","","","","","","","","","",""
"T49DG9QK","journalArticle","","Formanek, Claude; Tilbury, Callum Rhys; Beyers, Louise; Shock, Jonathan; Pretorius, Arnu","Dispelling the Mirage of Progress in Offline MARL through Standardised Baselines and Evaluation","","","","","","Offline multi-agent reinforcement learning (MARL) is an emerging field with great promise for real-world applications. Unfortunately, the current state of research in offline MARL is plagued by inconsistencies in baselines and evaluation protocols, which ultimately makes it difficult to accurately assess progress, trust newly proposed innovations, and allow researchers to easily build upon prior work. In this paper, we firstly identify significant shortcomings in existing methodologies for measuring the performance of novel algorithms through a representative study of published offline MARL work. Secondly, by directly comparing to this prior work, we demonstrate that simple, well-implemented baselines can achieve stateof-the-art (SOTA) results across a wide range of tasks. Specifically, we show that on 35 out of 47 datasets used in prior work (almost 75% of cases), we match or surpass the performance of the current purported SOTA. Strikingly, our baselines often substantially outperform these more sophisticated algorithms. Finally, we correct for the shortcomings highlighted from this prior work by introducing a straightforward standardised methodology for evaluation and by providing our baseline implementations with statistically robust results across several scenarios, useful for comparisons in future work. Our proposal includes simple and sensible steps that are easy to adopt, which in combination with solid baselines and comparative results, could substantially improve the overall rigour of empirical science in offline MARL moving forward.","","2025-03-30 16:29:27","2025-03-30 16:29:27","","","","","","","","","","","","","","","en","","","","","Zotero","","","","/Users/nikolajmosgaardsomod/Zotero/storage/8J96UYG5/Formanek et al. - Dispelling the Mirage of Progress in Offline MARL through Standardised Baselines and Evaluation.pdf","","","","","","","","","","","","","","","","","","","","","","","","","","","","","","","","","","","","","","","","","","","","","","","","",""
"N8AHTGIX","journalArticle","","Martinez, Julieta; Kim, Emily; Romero, Javier; Bagautdinov, Timur; Saito, Shunsuke; Yu, Shoou-I; Anderson, Stuart; Zollhöfer, Michael; Wang, Te-Li; Bai, Shaojie; Li, Chenghui; Wei, Shih-En; Joshi, Rohan; Borsos, Wyatt; Simon, Tomas; Saragih, Jason; Theodosis, Paul; Greene, Alexander; Josyula, Anjani; Maeta, Silvio Mano; Jewett, Andrew I; Venshtain, Simon; Heilman, Christopher; Chen, Yueh-Tung; Fu, Sidi; Elshaer, Mohamed Ezzeldin A; Du, Tingfang; Wu, Longhua; Chen, Shen-Chi; Kang, Kai; Wu, Michael; Emad, Youssef; Longay, Steven; Brewer, Ashley; Shah, Hitesh; Booth, James; Koska, Taylor; Haidle, Kayla; Andromalos, Matt; Hsu, Joanna; Dauer, Thomas; Selednik, Peter; Godisart, Tim; Ardisson, Scott; Cipperly, Matthew; Humberston, Ben; Farr, Lon; Hansen, Bob; Guo, Peihong; Braun, Dave; Krenn, Steven; Wen, He; Evans, Lucas; Fadeeva, Natalia; Stewart, Matthew; Schwartz, Gabriel; Gupta, Divam; Moon, Gyeongsik; Guo, Kaiwen; Dong, Yuan; Xu, Yichen; Shiratori, Takaaki; Prada, Fabian; Pires, Bernardo R; Peng, Bo; Buffalini, Julia; Trimble, Autumn; McPhail, Kevyn; Schoeller, Melissa; Sheikh, Yaser","Codec Avatar Studio: Paired Human Captures for Complete, Driveable, and Generalizable Avatars","","","","","","To create photorealistic avatars that users can embody, human modeling must be complete (encompass the full body), driveable (able to reproduce motion of the user from lightweight sensors), and generalizable (i.e., easily adaptable to novel identities). Towards these goals, paired captures, that is, captures of the same subject obtained from systems of diverse quality and availability, are crucial. However, paired captures are rarely available to researchers outside of dedicated industrial labs: Codec Avatar Studio is our proposal to close this gap. Towards generalization and driveability, we introduce a dataset of 256 subjects captured in two modalities: high resolution multi-view scans of their heads, and video from the internal cameras of a headset. Towards completeness, we introduce a dataset of 4 subjects captured in eight modalities: high quality relightable multi-view captures of heads and hands, full body multi-view captures with minimal and regular clothes, and corresponding head, hands and body phone captures. Together with our data, we also provide code and pre-trained models for different state-of-the-art human generation models. Our datasets and code are available at https://github.com/facebookresearch/ava-256 and https://github.com/facebookresearch/goliath.","","2025-03-30 16:29:29","2025-03-30 16:29:29","","","","","","","","","","","","","","","en","","","","","Zotero","","","","/Users/nikolajmosgaardsomod/Zotero/storage/WUXGSWYL/Martinez et al. - Codec Avatar Studio Paired Human Captures for Complete, Driveable, and Generalizable Avatars.pdf","","","","","","","","","","","","","","","","","","","","","","","","","","","","","","","","","","","","","","","","","","","","","","","","",""
