"FWP7L65Q","journalArticle","","Li, Yuhan; Wang, Peisong; Zhu, Xiao; Chen, Aochuan; Jiang, Haiyun; Cai, Deng; Chan, Victor Wai Kin; Li, Jia","GLBench: A Comprehensive Benchmark for Graph with Large Language Models","","","","","","The emergence of large language models (LLMs) has revolutionized the way we interact with graphs, leading to a new paradigm called GraphLLM. Despite the rapid development of GraphLLM methods in recent years, the progress and understanding of this field remain unclear due to the lack of a benchmark with consistent experimental protocols. To bridge this gap, we introduce GLBench, the first comprehensive benchmark for evaluating GraphLLM methods in both supervised and zero-shot scenarios. GLBench provides a fair and thorough evaluation of different categories of GraphLLM methods, along with traditional baselines such as graph neural networks. Through extensive experiments on a collection of real-world datasets with consistent data processing and splitting strategies, we have uncovered several key findings. Firstly, GraphLLM methods outperform traditional baselines in supervised settings, with LLM-as-enhancers showing the most robust performance. However, using LLMs as predictors is less effective and often leads to uncontrollable output issues. We also notice that no clear scaling laws exist for current GraphLLM methods. In addition, both structures and semantics are crucial for effective zero-shot transfer, and our proposed simple baseline can even outperform several models tailored for zero-shot scenarios. The data and code of the benchmark can be found at https://github.com/NineAbyss/GLBench.","","2025-03-30 16:26:35","2025-03-30 16:26:35","","","","","","","","","","","","","","","en","","","","","Zotero","","","","/Users/nikolajmosgaardsomod/Zotero/storage/UKXWMTTI/Li et al. - GLBench A Comprehensive Benchmark for Graph with Large Language Models.pdf","","","","","","","","","","","","","","","","","","","","","","","","","","","","","","","","","","","","","","","","","","","","","","","","",""
"J8EMV5YS","journalArticle","","Wen, Bosi; Ke, Pei; Gu, Xiaotao; Wu, Lindong; Huang, Hao; Zhou, Jinfeng; Li, Wenchuang; Hu, Binxin; Gao, Wendy; Xu, Jiaxin; Liu, Yiming; Tang, Jie; Wang, Hongning; Huang, Minlie","Benchmarking Complex Instruction-Following with Multiple Constraints Composition","","","","","","Instruction following is one of the fundamental capabilities of large language models (LLMs). As the ability of LLMs is constantly improving, they have been increasingly applied to deal with complex human instructions in real-world scenarios. Therefore, how to evaluate the ability of complex instruction-following of LLMs has become a critical research problem. Existing benchmarks mainly focus on modeling different types of constraints in human instructions while neglecting the composition of different constraints, which is an indispensable constituent in complex instructions. To this end, we propose ComplexBench, a benchmark for comprehensively evaluating the ability of LLMs to follow complex instructions composed of multiple constraints. We propose a hierarchical taxonomy for complex instructions, including 4 constraint types, 19 constraint dimensions, and 4 composition types, and manually collect a high-quality dataset accordingly. To make the evaluation reliable, we augment LLM-based evaluators with rules to effectively verify whether generated texts can satisfy each constraint and composition. Furthermore, we obtain the final evaluation score based on the dependency structure determined by different composition types. ComplexBench identifies significant deficiencies in existing LLMs when dealing with complex instructions with multiple constraints composition1.","","2025-03-30 16:26:36","2025-03-30 16:26:36","","","","","","","","","","","","","","","en","","","","","Zotero","","","","/Users/nikolajmosgaardsomod/Zotero/storage/BLNYJ4HC/Wen et al. - Benchmarking Complex Instruction-Following with Multiple Constraints Composition.pdf","","","","","","","","","","","","","","","","","","","","","","","","","","","","","","","","","","","","","","","","","","","","","","","","",""
"WC8TCSAT","journalArticle","","Romero, David; Lyu, Chenyang; Wibowo, Haryo Akbarianto; Lynn, Teresa; Hamed, Injy; Kishore, Aditya Nanda; Mandal, Aishik; Dragonetti, Alina; Abzaliev, Artem; Tonja, Atnafu Lambebo; Balcha, Bontu Fufa; Whitehouse, Chenxi; Salamea, Christian; Velasco, Dan John; Adelani, David Ifeoluwa; Meur, David Le; Villa-Cueva, Emilio; Koto, Fajri; Farooqui, Fauzan; Belcavello, Frederico; Batnasan, Ganzorig; Vallejo, Gisela; Caulfield, Grainne; Ivetta, Guido; Song, Haiyue; Ademtew, Henok Biadglign; Maina, Hernán; Ortiz-Barajas, Jesus-German; Baek, Jinheon; Dunstan, Jocelyn; Alemany, Laura Alonso; Nagasinghe, Kumaranage Ravindu Yasas; Benotti, Luciana; D’Haro, Luis Fernando; Viridiano, Marcelo; Estecha-Garitagoitia, Marcos; Cabrera, Maria Camila Buitrago; Rodríguez-Cantelar, Mario; Jouitteau, Mélanie; Mihaylov, Mihail; Etori, Naome; Imam, Mohamed Fazli Mohamed; Adilazuarda, Muhammad Farid; Gochoo, Munkhjargal; Otgonbold, Munkh-Erdene; Niyomugisha, Olivier; Silva, Paula Mónica; Chitale, Pranjal; Dabre, Raj; Chevi, Rendi; Zhang, Ruochen; Diandaru, Ryandito; Cahyawijaya, Samuel; Góngora, Santiago; Jeong, Soyeong; Purkayastha, Sukannya; Kuribayashi, Tatsuki; Clifford, Teresa; Jayakumar, Thanmay; Torrent, Tiago Timponi; Ehsan, Toqeer; Araujo, Vladimir; Kementchedjhieva, Yova; Burzo, Zara; Lim, Zheng Wei; Yong, Zheng Xin; Ignat, Oana; Nwatu, Joan; Mihalcea, Rada; Solorio, Thamar; Aji, Alham Fikri","CVQA: Culturally-diverse Multilingual Visual Question Answering Benchmark","","","","","","","","2025-03-30 16:26:38","2025-03-30 16:26:38","","","","","","","","","","","","","","","en","","","","","Zotero","","","","/Users/nikolajmosgaardsomod/Zotero/storage/N3TTXLMZ/Romero et al. - CVQA Culturally-diverse Multilingual Visual Question Answering Benchmark.pdf","","","","","","","","","","","","","","","","","","","","","","","","","","","","","","","","","","","","","","","","","","","","","","","","",""
"6EYVI5RH","journalArticle","","Alberts, Marvin; Schilter, Oliver; Zipoli, Federico; Hartrampf, Nina; Laino, Teodoro","Unraveling Molecular Structure: A Multimodal Spectroscopic Dataset for Chemistry","","","","","","Spectroscopic techniques are essential tools for determining the structure of molecules. Different spectroscopic techniques, such as Nuclear magnetic resonance (NMR), Infrared spectroscopy, and Mass Spectrometry, provide insight into the molecular structure, including the presence or absence of functional groups. Chemists leverage the complementary nature of the different methods to their advantage. However, the lack of a comprehensive multimodal dataset, containing spectra from a variety of spectroscopic techniques, has limited machine-learning approaches mostly to single-modality tasks for predicting molecular structures from spectra. Here we introduce a dataset comprising simulated 1H-NMR, 13CNMR, HSQC-NMR, Infrared, and Mass spectra (positive and negative ion modes) for 790k molecules extracted from chemical reactions in patent data. This dataset enables the development of foundation models for integrating information from multiple spectroscopic modalities, emulating the approach employed by human experts. Additionally, we provide benchmarks for evaluating single-modality tasks such as structure elucidation, predicting the spectra for a target molecule, and functional group predictions. This dataset has the potential automate structure elucidation, streamlining the molecular discovery pipeline from synthesis to structure determination. The dataset and code for the benchmarks can be found at https: //rxn4chemistry.github.io/multimodal-spectroscopic-dataset.","","2025-03-30 16:26:39","2025-03-30 16:26:39","","","","","","","","","","","","","","","en","","","","","Zotero","","","","/Users/nikolajmosgaardsomod/Zotero/storage/YX2H5MLY/Alberts et al. - Unraveling Molecular Structure A Multimodal Spectroscopic Dataset for Chemistry.pdf","","","","","","","","","","","","","","","","","","","","","","","","","","","","","","","","","","","","","","","","","","","","","","","","",""
"E8HEUPJX","journalArticle","","Fent, Felix; Kuttenreich, Fabian; Ruch, Florian; Rizwin, Farija; Juergens, Stefan; Lechermann, Lorenz; Nissler, Christian; Perl, Andrea; Voll, Ulrich; Yan, Min; Lienkamp, Markus","MAN TruckScenes: A multimodal dataset for autonomous trucking in diverse conditions","","","","","","Autonomous trucking is a promising technology that can greatly impact modern logistics and the environment. Ensuring its safety on public roads is one of the main duties that requires an accurate perception of the environment. To achieve this, machine learning methods rely on large datasets, but to this day, no such datasets are available for autonomous trucks. In this work, we present MAN TruckScenes, the first multimodal dataset for autonomous trucking. MAN TruckScenes allows the research community to come into contact with truck-specific challenges, such as trailer occlusions, novel sensor perspectives, and terminal environments for the first time. It comprises more than 740 scenes of 20 s each within a multitude of different environmental conditions. The sensor set includes 4 cameras, 6 lidar, 6 radar sensors, 2 IMUs, and a high-precision GNSS. The dataset’s 3D bounding boxes were manually annotated and carefully reviewed to achieve a high quality standard. Bounding boxes are available for 27 object classes, 15 attributes, and a range of more than 230 m. The scenes are tagged according to 34 distinct scene tags, and all objects are tracked throughout the scene to promote a wide range of applications. Additionally, MAN TruckScenes is the first dataset to provide 4D radar data with 360° coverage and is thereby the largest radar dataset with annotated 3D bounding boxes. Finally, we provide extensive dataset analysis and baseline results. The dataset, development kit, and more are available online.","","2025-03-30 16:26:40","2025-03-30 16:26:40","","","","","","","","","","","","","","","en","","","","","Zotero","","","","/Users/nikolajmosgaardsomod/Zotero/storage/X7YWL6R7/Fent et al. - MAN TruckScenes A multimodal dataset for autonomous trucking in diverse conditions.pdf","","","","","","","","","","","","","","","","","","","","","","","","","","","","","","","","","","","","","","","","","","","","","","","","",""
"PJVIYPQ4","journalArticle","","Varbella, Anna; Amara, Kenza; Gjorgiev, Blazhe; El-Assady, Mennatallah; Sansavini, Giovanni","PowerGraph: A power grid benchmark dataset for graph neural networks","","","","","","","","2025-03-30 16:26:41","2025-03-30 16:26:41","","","","","","","","","","","","","","","en","","","","","Zotero","","","","/Users/nikolajmosgaardsomod/Zotero/storage/XSLBYTHM/Varbella et al. - PowerGraph A power grid benchmark dataset for graph neural networks.pdf","","","","","","","","","","","","","","","","","","","","","","","","","","","","","","","","","","","","","","","","","","","","","","","","",""
"AU362KL9","journalArticle","","Debenedetti, Edoardo; Zhang, Jie; Balunovic, Mislav; Beurer-Kellner, Luca; Fischer, Marc; Tramèr, Florian","AgentDojo: A Dynamic Environment to Evaluate Prompt Injection Attacks and Defenses for LLM Agents","","","","","","AI agents aim to solve complex tasks by combining text-based reasoning with external tool calls. Unfortunately, AI agents are vulnerable to prompt injection attacks where data returned by external tools hijacks the agent to execute malicious tasks. To measure the adversarial robustness of AI agents, we introduce AgentDojo, an evaluation framework for agents that execute tools over untrusted data. To capture the evolving nature of attacks and defenses, AgentDojo is not a static test suite, but rather an extensible environment for designing and evaluating new agent tasks, defenses, and adaptive attacks. We populate the environment with 97 realistic tasks (e.g., managing an email client, navigating an e-banking website, or making travel bookings), 629 security test cases, and various attack and defense paradigms from the literature. We find that AgentDojo poses a challenge for both attacks and defenses: state-of-the-art LLMs fail at many tasks (even in the absence of attacks), and existing prompt injection attacks break some security properties but not all. We hope that AgentDojo can foster research on new design principles for AI agents that solve common tasks in a reliable and robust manner.","","2025-03-30 16:26:42","2025-03-30 16:26:42","","","","","","","","","","","","","","","en","","","","","Zotero","","","","/Users/nikolajmosgaardsomod/Zotero/storage/7TFJGTDT/Debenedetti et al. - AgentDojo A Dynamic Environment to Evaluate Prompt Injection Attacks and Defenses for LLM Agents.pdf","","","","","","","","","","","","","","","","","","","","","","","","","","","","","","","","","","","","","","","","","","","","","","","","",""
"DRE5R9AI","journalArticle","","Chen, Pengcheng; Ye, Jin; Wang, Guoan; Li, Yanjun; Deng, Zhongying; Li, Wei; Li, Tianbin; Duan, Haodong; Huang, Ziyan; Su, Yanzhou; Wang, Benyou; Zhang, Shaoting; Fu, Bin; Cai, Jianfei; Zhuang, Bohan; Seibel, Eric J; Qiao, Yu; He, Junjun","GMAI-MMBench: A Comprehensive Multimodal Evaluation Benchmark Towards General Medical AI","","","","","","","","2025-03-30 16:26:44","2025-03-30 16:26:44","","","","","","","","","","","","","","","en","","","","","Zotero","","","","/Users/nikolajmosgaardsomod/Zotero/storage/66SCIJ4B/Chen et al. - GMAI-MMBench A Comprehensive Multimodal Evaluation Benchmark Towards General Medical AI.pdf","","","","","","","","","","","","","","","","","","","","","","","","","","","","","","","","","","","","","","","","","","","","","","","","",""
"XPAKHQ4Y","journalArticle","","Bandara, Nuwan; Kandappu, Thivya; Sen, Argha; Gokarn, Ila; Misra, Archan","EyeGraph: Modularity-aware Spatio Temporal Graph Clustering for Continuous Event-based Eye Tracking","","","","","","Continuous tracking of eye movement dynamics plays a significant role in developing a broad spectrum of human-centered applications, such as cognitive skills modeling, biometric user authentication, and foveated rendering. Recently neuromorphic cameras have garnered significant interest in the eye-tracking research community, owing to their sub-microsecond latency in capturing intensity changes resulting from eye movements. Nevertheless, the existing approaches for eventbased eye tracking suffer from several limitations: dependence on RGB frames, label sparsity, and training on datasets collected in controlled lab environments that do not adequately reflect real-world scenarios. To address these limitations, in this paper, we propose a dynamic graph-based approach that uses the event stream for high-fidelity tracking of pupillary movement. We first present EyeGraph, a large-scale, multi-modal near-eye tracking dataset collected using a wearable event camera attached to a head-mounted device from 40 participants – the dataset was curated while mimicking in-the-wild settings, with variations in user movement and ambient lighting conditions. Subsequently, to address the issue of label sparsity, we propose an unsupervised topology-aware spatio-temporal graph clustering approach as a benchmark. We show that our unsupervised approach achieves performance comparable to more onerous supervised approaches while consistently outperforming the conventional clustering-based unsupervised approaches.","","2025-03-30 16:26:45","2025-03-30 16:26:45","","","","","","","","","","","","","","","en","","","","","Zotero","","","","/Users/nikolajmosgaardsomod/Zotero/storage/L2YXV7A6/Bandara et al. - EyeGraph Modularity-aware Spatio Temporal Graph Clustering for Continuous Event-based Eye Tracking.pdf","","","","","","","","","","","","","","","","","","","","","","","","","","","","","","","","","","","","","","","","","","","","","","","","",""
"THYZLHQB","journalArticle","","Reuel, Anka; Hardy, Amelia; Smith, Chandler; Lamparth, Max; Hardy, Malcolm; Kochenderfer, Mykel J","BetterBench: Assessing AI Benchmarks, Uncovering Issues, and Establishing Best Practices","","","","","","","","2025-03-30 16:26:46","2025-03-30 16:26:46","","","","","","","","","","","","","","","en","","","","","Zotero","","","","/Users/nikolajmosgaardsomod/Zotero/storage/EZ8VYI99/Reuel et al. - BetterBench Assessing AI Benchmarks, Uncovering Issues, and Establishing Best Practices.pdf","","","","","","","","","","","","","","","","","","","","","","","","","","","","","","","","","","","","","","","","","","","","","","","","",""
"S5F28W2U","journalArticle","","Ding, Mucong; Deng, Chenghao; Choo, Jocelyn; Wu, Zichu; Agrawal, Aakriti; Schwarzschild, Avi; Zhou, Tianyi; Goldstein, Tom; Langford, John; Anandkumar, Anima; Huang, Furong","Easy2Hard-Bench: Standardized Difficulty Labels for Profiling LLM Performance and Generalization","","","","","","While generalization over tasks from easy to hard is crucial to profile language models (LLMs), the datasets with fine-grained difficulty annotations for each problem across a broad range of complexity are still missing. Aiming to address this limitation, we present Easy2Hard-Bench, a consistently formatted collection of 6 benchmark datasets spanning various domains, such as mathematics and programming problems, chess puzzles, and reasoning questions. Each problem within these datasets is annotated with numerical difficulty scores. To systematically estimate problem difficulties, we collect abundant performance data on attempts to each problem by humans in the real world or LLMs on the prominent leaderboard. Leveraging the rich performance data, we apply well-established difficulty ranking systems, such as Item Response Theory (IRT) and Glicko-2 models, to uniformly assign numerical difficulty scores to problems. Moreover, datasets in Easy2Hard-Bench distinguish themselves from previous collections by a higher proportion of challenging problems. Through extensive experiments with six stateof-the-art LLMs, we provide a comprehensive analysis of their performance and generalization capabilities across varying levels of difficulty, with the aim of inspiring future research in LLM generalization. The datasets are available at https: //huggingface.co/datasets/furonghuang-lab/Easy2Hard-Bench.","","2025-03-30 16:26:48","2025-03-30 16:26:48","","","","","","","","","","","","","","","en","","","","","Zotero","","","","/Users/nikolajmosgaardsomod/Zotero/storage/P7XPZKR4/Ding et al. - Easy2Hard-Bench Standardized Difficulty Labels for Profiling LLM Performance and Generalization.pdf","","","","","","","","","","","","","","","","","","","","","","","","","","","","","","","","","","","","","","","","","","","","","","","","",""
"HM2HMXGU","journalArticle","","Ren, Richard; Basart, Steven; Khoja, Adam; Pan, Alexander; Gatti, Alice; Phan, Long; Yin, Xuwang; Mazeika, Mantas; Mukobi, Gabriel; Kim, Ryan Hwang; Fitz, Stephen; Hendrycks, Dan","Safetywashing: Do AI Safety Benchmarks Actually Measure Safety Progress?","","","","","","Performance on popular ML benchmarks is highly correlated with model scale, suggesting that most benchmarks tend to measure a similar underlying factor of general model capabilities. However, substantial research effort remains devoted to designing new benchmarks, many of which claim to measure novel phenomena. In the spirit of the Bitter Lesson, we leverage spectral analysis to measure an underlying capabilities component, the direction in benchmark-performance-space which explains most variation in model performance. In an extensive analysis of existing safety benchmarks, we find that variance in model performance on many safety benchmarks is largely explained by the capabilities component. In response, we argue that safety research should prioritize metrics which are not highly correlated with scale. Our work provides a lens to analyze both novel safety benchmarks and novel safety methods, which we hope will enable future work to make differential progress on safety.","","2025-03-30 16:26:49","2025-03-30 16:26:49","","","","","","","","","","","","","","","en","","","","","Zotero","","","","/Users/nikolajmosgaardsomod/Zotero/storage/7GYTETF9/Ren et al. - Safetywashing Do AI Safety Benchmarks Actually Measure Safety Progress.pdf","","","","","","","","","","","","","","","","","","","","","","","","","","","","","","","","","","","","","","","","","","","","","","","","",""
"73YR5DPZ","journalArticle","","González-Duque, Miguel; Michael, Richard; Bartels, Simon; Zainchkovskyy, Yevgen; Hauberg, Søren; Boomsma, Wouter","A survey and benchmark of high-dimensional Bayesian optimization of discrete sequences","","","","","","Optimizing discrete black box functions is key in several domains, e.g. protein engineering and drug design. Due to the lack of gradient information and the need for sample efficiency, Bayesian optimization is an ideal candidate for these tasks. Several methods for high-dimensional continuous and categorical Bayesian optimization have been proposed recently. However, our survey of the field reveals highly heterogeneous experimental set-ups across methods and technical barriers for the replicability and application of published algorithms to real-world tasks. To address these issues, we develop a unified framework to test a vast array of high-dimensional Bayesian optimization methods and a collection of standardized black box functions representing real-world application domains in chemistry and biology. These two components of the benchmark are each supported by flexible, scalable, and easily extendable software libraries (poli and poli-baselines), allowing practitioners to readily incorporate new optimization objectives or discrete optimizers. Project website: https://machinelearninglifescience.github.io/hdbo_benchmark.","","2025-03-30 16:26:52","2025-03-30 16:26:52","","","","","","","","","","","","","","","en","","","","","Zotero","","","","/Users/nikolajmosgaardsomod/Zotero/storage/EXSQ8JRC/González-Duque et al. - A survey and benchmark of high-dimensional Bayesian optimization of discrete sequences.pdf","","","","","","","","","","","","","","","","","","","","","","","","","","","","","","","","","","","","","","","","","","","","","","","","",""
"QQU45MB6","journalArticle","","Song, Jian; Chen, Hongruixuan; Xuan, Weihao; Xia, Junshi; Yokoya, Naoto","SynRS3D: A Synthetic Dataset for Global 3D Semantic Understanding from Monocular Remote Sensing Imagery","","","","","","Global semantic 3D understanding from single-view high-resolution remote sensing (RS) imagery is crucial for Earth observation (EO). However, this task faces significant challenges due to the high costs of annotations and data collection, as well as geographically restricted data availability. To address these challenges, synthetic data offer a promising solution by being unrestricted and automatically annotatable, thus enabling the provision of large and diverse datasets. We develop a specialized synthetic data generation pipeline for EO and introduce SynRS3D, the largest synthetic RS dataset. SynRS3D comprises 69,667 high-resolution optical images that cover six different city styles worldwide and feature eight land cover types, precise height information, and building change masks. To further enhance its utility, we develop a novel multi-task unsupervised domain adaptation (UDA) method, RS3DAda, coupled with our synthetic dataset, which facilitates the RS-specific transition from synthetic to real scenarios for land cover mapping and height estimation tasks, ultimately enabling global monocular 3D semantic understanding based on synthetic data. Extensive experiments on various real-world datasets demonstrate the adaptability and effectiveness of our synthetic dataset and the proposed RS3DAda method. SynRS3D and related codes are available at https://github.com/JTRNEO/SynRS3D.","","2025-03-30 16:26:53","2025-03-30 16:26:53","","","","","","","","","","","","","","","en","","","","","Zotero","","","","/Users/nikolajmosgaardsomod/Zotero/storage/XREKZMB8/Song et al. - SynRS3D A Synthetic Dataset for Global 3D Semantic Understanding from Monocular Remote Sensing Imag.pdf","","","","","","","","","","","","","","","","","","","","","","","","","","","","","","","","","","","","","","","","","","","","","","","","",""
