"Key","Item Type","Publication Year","Author","Title","Publication Title","ISBN","ISSN","DOI","Url","Abstract Note","Date","Date Added","Date Modified","Access Date","Pages","Num Pages","Issue","Volume","Number Of Volumes","Journal Abbreviation","Short Title","Series","Series Number","Series Text","Series Title","Publisher","Place","Language","Rights","Type","Archive","Archive Location","Library Catalog","Call Number","Extra","Notes","File Attachments","Link Attachments","Manual Tags","Automatic Tags","Editor","Series Editor","Translator","Contributor","Attorney Agent","Book Author","Cast Member","Commenter","Composer","Cosponsor","Counsel","Interviewer","Producer","Recipient","Reviewed Author","Scriptwriter","Words By","Guest","Number","Edition","Running Time","Scale","Medium","Artwork Size","Filing Date","Application Number","Assignee","Issuing Authority","Country","Meeting Name","Conference Name","Court","References","Reporter","Legal Status","Priority Numbers","Programming Language","Version","System","Code","Code Number","Section","Session","Committee","History","Legislative Body"
"IHBLLIBV","dataset","2025","Hauser, Jakob Elias","HiST-LLM","","","","10.5281/ZENODO.14671247","https://zenodo.org/doi/10.5281/zenodo.14671247","Large Language Models (LLMs) have the potential to transform humanities and social science research, yet their history knowledge and comprehension at a graduate level remains untested. Benchmarking LLMs in history is particularly challenging, given that human knowledge of history is inherently unbalanced, with more information available on Western history and recent periods. We introduce the History Seshat Test for LLMs (HiST-LLM), based on a subset of the Seshat Global History Databank, which provides a structured representation of human historical knowledge, containing 36,000 data points across 600 historical societies and over 2,700 scholarly references. This dataset covers every major world region from the Neolithic period to the Industrial Revolution and includes information reviewed and assembled by history experts and graduate research assistants. Using this dataset, we benchmark a total of seven models from the Gemini, OpenAI, and Llama families. We find that, in a four-choice format, LLMs have a balanced accuracy ranging from 33.6% (Llama-3.1-8B) to 46% (GPT-4-Turbo), outperforming random guessing (25%) but falling short of expert comprehension. LLMs perform better on earlier historical periods. Regionally, performance is more even but still better for the Americas and lowest in Oceania and Sub-Saharan Africa for the more advanced models. Our benchmark shows that while LLMs possess some expert-level historical knowledge, there is considerable room for improvement.","2025-01-16","2025-03-30 16:21:25","2025-03-30 16:21:25","2025-03-30 16:21:25","","","","","","","","","","","","Zenodo","","en","Creative Commons Attribution 4.0 International","","","","DOI.org (Datacite)","","","","/Users/nikolajmosgaardsomod/Zotero/storage/2CXCPE2S/Hauser - 2025 - HiST-LLM.pdf","","","","","","","","","","","","","","","","","","","","","","","","","","","","","","","","","","","","","","","","","","","","","","","","",""
"58JV2V3K","journalArticle","","Dong, Linfeng; Wang, Wei; Qiao, Yu; Sun, Xiao","LucidAction: A Hierarchical and Multi-model Dataset for Comprehensive Action Quality Assessment","","","","","","","","2025-03-30 16:21:26","2025-03-30 16:21:26","","","","","","","","","","","","","","","en","","","","","Zotero","","","","/Users/nikolajmosgaardsomod/Zotero/storage/C878U7TI/Dong et al. - LucidAction A Hierarchical and Multi-model Dataset for Comprehensive Action Quality Assessment.pdf","","","","","","","","","","","","","","","","","","","","","","","","","","","","","","","","","","","","","","","","","","","","","","","","",""
"VRL2G4I9","journalArticle","","Zhang, Hang; Sun, Jiawei; Chen, Renqi; Liu, Wei; Yuan, Zhonghang; Zheng, Xinzhe; Wang, Zhefan; Yang, Zhiyuan; Yan, Hang; Zhong, Hansen; Wang, Xiqing; Ouyang, Wanli; Yang, Fan; Dong, Nanqing","Empowering and Assessing the Utility of Large Language Models in Crop Science","","","","","","Large language models (LLMs) have demonstrated remarkable efficacy across knowledge-intensive tasks. Nevertheless, their untapped potential in crop science presents an opportunity for advancement. To narrow this gap, we introduce CROP3, which includes a novel instruction tuning dataset specifically designed to enhance LLMs’ professional capabilities in the crop science sector, along with a benchmark that serves as a comprehensive evaluation of LLMs’ understanding of the domain knowledge. The CROP dataset is curated through a task-oriented and LLM-human integrated pipeline, comprising 210,038 single-turn and 1,871 multi-turn dialogues related to crop science scenarios. The CROP benchmark includes 5,045 multiplechoice questions covering three difficulty levels. Our experiments based on the CROP benchmark demonstrate notable enhancements in crop science-related tasks when LLMs are fine-tuned with the CROP dataset. To the best of our knowledge, CROP dataset is the first-ever instruction tuning dataset in the crop science domain. We anticipate that CROP will accelerate the adoption of LLMs in the domain of crop science, ultimately contributing to global food production.","","2025-03-30 16:21:28","2025-03-30 16:21:28","","","","","","","","","","","","","","","en","","","","","Zotero","","","","/Users/nikolajmosgaardsomod/Zotero/storage/DU25HTFE/Zhang et al. - Empowering and Assessing the Utility of Large Language Models in Crop Science.pdf","","","","","","","","","","","","","","","","","","","","","","","","","","","","","","","","","","","","","","","","","","","","","","","","",""
"IZFMDATR","journalArticle","","Luo, Jialin; Wang, Yuanzhi; Gu, Ziqi; Qiu, Yide; Yao, Shuaizhen; Wang, Fuyun; Xu, Chunyan; Zhang, Wenhua; Wang, Dan; Cui, Zhen","MMM-RS: A Multi-modal, Multi-GSD, Multi-scene Remote Sensing Dataset and Benchmark for Text-to-Image Generation","","","","","","Recently, the diffusion-based generative paradigm has achieved impressive general image generation capabilities with text prompts due to its accurate distribution modeling and stable training process. However, generating diverse remote sensing (RS) images that are tremendously different from general images in terms of scale and perspective remains a formidable challenge due to the lack of a comprehensive remote sensing image generation dataset with various modalities, ground sample distances (GSD), and scenes. In this paper, we propose a Multi-modal, MultiGSD, Multi-scene Remote Sensing (MMM-RS) dataset and benchmark for textto-image generation in diverse remote sensing scenarios. Specifically, we first collect nine publicly available RS datasets and conduct standardization for all samples. To bridge RS images to textual semantic information, we utilize a largescale pretrained vision-language model to automatically output text prompts and perform hand-crafted rectification, resulting in information-rich text-image pairs (including multi-modal images). In particular, we design some methods to obtain the images with different GSD and various environments (e.g., low-light, foggy) in a single sample. With extensive manual screening and refining annotations, we ultimately obtain a MMM-RS dataset that comprises approximately 2.1 million text-image pairs. Extensive experimental results verify that our proposed MMMRS dataset allows off-the-shelf diffusion models to generate diverse RS images across various modalities, scenes, weather conditions, and GSD. The dataset is available at https://github.com/ljl5261/MMM-RS.","","2025-03-30 16:21:29","2025-03-30 16:21:29","","","","","","","","","","","","","","","en","","","","","Zotero","","","","/Users/nikolajmosgaardsomod/Zotero/storage/26MHDYNT/Luo et al. - MMM-RS A Multi-modal, Multi-GSD, Multi-scene Remote Sensing Dataset and Benchmark for Text-to-Image.pdf","","","","","","","","","","","","","","","","","","","","","","","","","","","","","","","","","","","","","","","","","","","","","","","","",""
"I249SJTS","journalArticle","","Chen, Cheng; Zhu, Junchen; Luo, Xu; Shen, Heng Tao; Song, Jingkuan; Gao, Lianli","CoIN: A Benchmark of Continual Instruction Tuning for Multimodal Large Language Models","","","","","","Instruction tuning demonstrates impressive performance in adapting Multimodal Large Language Models (MLLMs) to follow task instructions and improve generalization ability. By extending tuning across diverse tasks, MLLMs can further enhance their understanding of world knowledge and instruction intent. However, continual instruction tuning has been largely overlooked and there are no public benchmarks available. In this paper, we present CoIN, a comprehensive benchmark tailored for assessing the behavior of existing MLLMs under continual instruction tuning. CoIN comprises 10 meticulously crafted datasets spanning 8 tasks, ensuring diversity and serving as a robust evaluation framework to assess crucial aspects of continual instruction tuning, such as task order, instruction diversity and volume. Additionally, apart from traditional evaluation, we design another LLM-based metric to assess the knowledge preserved within MLLMs for reasoning. Following an in-depth evaluation of several MLLMs, we demonstrate that they still suffer catastrophic forgetting, and the failure in instruction alignment assumes the main responsibility, instead of reasoning knowledge forgetting. To this end, we introduce MoELoRA which is effective in retaining the previous instruction alignment. Codes and datasets are publicly available https://github.com/zackschen/CoIN.","","2025-03-30 16:21:30","2025-03-30 16:21:30","","","","","","","","","","","","","","","en","","","","","Zotero","","","","/Users/nikolajmosgaardsomod/Zotero/storage/DDEL7PX2/Chen et al. - CoIN A Benchmark of Continual Instruction Tuning for Multimodal Large Language Models.pdf","","","","","","","","","","","","","","","","","","","","","","","","","","","","","","","","","","","","","","","","","","","","","","","","",""
"NG7SICZV","journalArticle","","Mou, Yutao; Zhang, Shikun; Ye, Wei","SG-Bench: Evaluating LLM Safety Generalization Across Diverse Tasks and Prompt Types","","","","","","Ensuring the safety of large language model (LLM) applications is essential for developing trustworthy artificial intelligence. Current LLM safety benchmarks have two limitations. First, they focus solely on either discriminative or generative evaluation paradigms while ignoring their interconnection. Second, they rely on standardized inputs, overlooking the effects of widespread prompting techniques, such as system prompts, few-shot demonstrations, and chain-of-thought prompting. To overcome these issues, we developed SG-Bench, a novel benchmark to assess the generalization of LLM safety across various tasks and prompt types. This benchmark integrates both generative and discriminative evaluation tasks and includes extended data to examine the impact of prompt engineering and jailbreak on LLM safety. Our assessment of 3 advanced proprietary LLMs and 10 opensource LLMs with the benchmark reveals that most LLMs perform worse on discriminative tasks than generative ones, and are highly susceptible to prompts, indicating poor generalization in safety alignment. We also explain these findings quantitatively and qualitatively to provide insights for future research.2 Warning: this paper includes examples that may be offensive or harmful.","","2025-03-30 16:21:32","2025-03-30 16:21:32","","","","","","","","","","","","","","","en","","","","","Zotero","","","","/Users/nikolajmosgaardsomod/Zotero/storage/545S2GV7/Mou et al. - SG-Bench Evaluating LLM Safety Generalization Across Diverse Tasks and Prompt Types.pdf","","","","","","","","","","","","","","","","","","","","","","","","","","","","","","","","","","","","","","","","","","","","","","","","",""
"N2NIA4VB","journalArticle","","Yan, Zhiyuan; Yao, Taiping; Chen, Shen; Zhao, Yandan; Fu, Xinghe; Zhu, Junwei; Luo, Donghao; Wang, Chengjie; Ding, Shouhong; Wu, Yunsheng; Yuan, Li","DF40: Toward Next-Generation Deepfake Detection","","","","","","We propose a new comprehensive benchmark to revolutionize the current deepfake detection field to the next generation. Predominantly, existing works identify top-notch detection algorithms and models by adhering to the common practice: training detectors on one specific dataset (e.g., FF++ [62]) and testing them on other prevalent deepfake datasets. This protocol is often regarded as a ""golden compass"" for navigating SoTA detectors. But can these stand-out ""winners"" be truly applied to tackle the myriad of realistic and diverse deepfakes lurking in the real world? If not, what underlying factors contribute to this gap? In this work, we found the dataset (both train and test) can be the ""primary culprit"" due to the following: (1) forgery diversity: Deepfake techniques are commonly referred to as both face forgery (face-swapping and face-reenactment) and entire face synthesis (especially face). Most existing datasets only contain partial types of them, with limited forgery methods implemented (e.g., 2 swapping and 2 reenactment methods in FF++); (2) forgery realism: The dominated training dataset, FF++, contains out-of-date forgery techniques from the past four years. ""Honing skills"" on these forgeries makes it difficult to guarantee effective detection generalization toward nowadays’ SoTA deepfakes; (3) evaluation protocol: Most detection works perform evaluations on one type, e.g., training and testing on face-swapping types only, which hinders the development of universal deepfake detectors. To address this dilemma, we construct a highly diverse and large-scale deepfake detection dataset called DF40, which comprises 40 distinct deepfake techniques (10 times larger than FF++). We then conduct comprehensive evaluations using 4 standard evaluation protocols and 8 representative detection methods, resulting in over 2,000 evaluations. Through these evaluations, we provide an extensive analysis from various perspectives, leading to 7 new insightful findings contributing to the field. We also open up 4 valuable yet previously underexplored research questions to inspire future works. We release our dataset, code, and checkpoints at https://github.com/YZY-stack/DF40.","","2025-03-30 16:21:34","2025-03-30 16:21:34","","","","","","","","","","","","","","","en","","","","","Zotero","","","","/Users/nikolajmosgaardsomod/Zotero/storage/K2HK67XB/Yan et al. - DF40 Toward Next-Generation Deepfake Detection.pdf","","","","","","","","","","","","","","","","","","","","","","","","","","","","","","","","","","","","","","","","","","","","","","","","",""
"ASZDEX82","journalArticle","","Hui, Yulong; Lu, Yao; Zhang, Huanchen","UDA: A Benchmark Suite for Retrieval Augmented Generation in Real-world Document Analysis","","","","","","The use of Retrieval-Augmented Generation (RAG) has improved Large Language Models (LLMs) in collaborating with external data, yet significant challenges exist in real-world scenarios. In areas such as academic literature and finance question answering, data are often found in raw text and tables in HTML or PDF formats, which can be lengthy and highly unstructured. In this paper, we introduce a benchmark suite, namely Unstructured Document Analysis (UDA), that involves 2,965 real-world documents and 29,590 expert-annotated Q&A pairs. We revisit popular LLM- and RAG-based solutions for document analysis and evaluate the design choices and answer qualities across multiple document domains and diverse query types. Our evaluation yields interesting findings and highlights the importance of data parsing and retrieval. We hope our benchmark can shed light and better serve real-world document analysis applications. The benchmark suite and code can be found at https://github.com/qinchuanhui/UDA-Benchmark.","","2025-03-30 16:21:35","2025-03-30 16:21:35","","","","","","","","","","","","","","","en","","","","","Zotero","","","","/Users/nikolajmosgaardsomod/Zotero/storage/F6QQHA3S/Hui et al. - UDA A Benchmark Suite for Retrieval Augmented Generation in Real-world Document Analysis.pdf","","","","","","","","","","","","","","","","","","","","","","","","","","","","","","","","","","","","","","","","","","","","","","","","",""
"CYUKMDR3","journalArticle","","Cao, Jiahuan; Liu, Yang; Shi, Yongxin; Ding, Kai; Jin, Lianwen","WenMind: A Comprehensive Benchmark for Evaluating Large Language Models in Chinese Classical Literature and Language Arts","","","","","","Large Language Models (LLMs) have made significant advancements across numerous domains, but their capabilities in Chinese Classical Literature and Language Arts (CCLLA) remain largely unexplored due to the limited scope and tasks of existing benchmarks. To fill this gap, we propose WenMind, a comprehensive benchmark dedicated for evaluating LLMs in CCLLA. WenMind covers the sub-domains of Ancient Prose, Ancient Poetry, and Ancient Literary Culture, comprising 4,875 question-answer pairs, spanning 42 fine-grained tasks, 3 question formats, and 2 evaluation scenarios: domain-oriented and capability-oriented. Based on WenMind, we conduct a thorough evaluation of 31 representative LLMs, including general-purpose models and ancient Chinese LLMs. The results reveal that even the best-performing model, ERNIE-4.0, only achieves a total score of 64.3, indicating significant room for improvement of LLMs in the CCLLA domain. We also provide insights into the strengths and weaknesses of different LLMs and highlight the importance of pre-training data in achieving better results. Overall, WenMind serves as a standardized and comprehensive baseline, providing valuable insights for future CCLLA research. Our benchmark and related code are available at https://github.com/SCUT-DLVCLab/WenMind.","","2025-03-30 16:21:37","2025-03-30 16:21:37","","","","","","","","","","","","","","","en","","","","","Zotero","","","","/Users/nikolajmosgaardsomod/Zotero/storage/QY9DCSFA/Cao et al. - WenMind A Comprehensive Benchmark for Evaluating Large Language Models in Chinese Classical Literat.pdf","","","","","","","","","","","","","","","","","","","","","","","","","","","","","","","","","","","","","","","","","","","","","","","","",""
"MDWXU772","journalArticle","","Gong, Biao; Tan, Shuai; Feng, Yutong; Xie, Xiaoying; Li, Yuyuan; Chen, Chaochao; Zheng, Kecheng; Shen, Yujun; Zhao, Deli","UKnow: A Unified Knowledge Protocol with Multimodal Knowledge Graph Datasets for Reasoning and Vision-Language Pre-Training","","","","","","This work presents a unified knowledge protocol, called UKnow, which facilitates knowledge-based studies from the perspective of data. Particularly focusing on visual and linguistic modalities, we categorize data knowledge into five unit types, namely, in-image, in-text, cross-image, cross-text, and image-text, and set up an efficient pipeline to help construct the multimodal knowledge graph from any data collection. Thanks to the logical information naturally contained in knowledge graph, organizing datasets under UKnow format opens up more possibilities of data usage compared to the commonly used image-text pairs. Following UKnow protocol, we collect, from public international news, a large-scale multimodal knowledge graph dataset that consists of 1,388,568 nodes (with 571,791 visionrelated ones) and 3,673,817 triplets. The dataset is also annotated with rich event tags, including 11 coarse labels and 9,185 fine labels. Experiments on 4 benchmarks demonstrate the potential of UKnow in supporting common-sense reasoning and boosting vision-language pre-training with a single dataset, benefiting from its unified form of knowledge organization. See Appendix A to download the dataset.","","2025-03-30 16:21:38","2025-03-30 16:21:38","","","","","","","","","","","","","","","en","","","","","Zotero","","","","/Users/nikolajmosgaardsomod/Zotero/storage/T9HN9UHU/Gong et al. - UKnow A Unified Knowledge Protocol with Multimodal Knowledge Graph Datasets for Reasoning and Visio.pdf","","","","","","","","","","","","","","","","","","","","","","","","","","","","","","","","","","","","","","","","","","","","","","","","",""
"86HQJEK3","journalArticle","","Lin, Shuyi; He, Haoyu; Wei, Tianhao; Xu, Kaidi; Zhang, Huan; Singh, Gagandeep; Liu, Changliu; Tan, Cheng","NN4SysBench: Characterizing Neural Network Verification for Computer Systems","","","","","","We present NN4SysBench, a benchmark suite for neural network verification that is composed of applications from the domain of computer systems. We call these neural networks for computer systems or NN4Sys. NN4Sys is booming: there are many proposals for using neural networks in computer systems—for example, databases, OSes, and networked systems—many of which are safetycritical. Neural network verification is a technique to formally verify whether neural networks satisfy safety properties. We however observe that NN4Sys has some unique characteristics that today’s verification tools overlook and have limited support. Therefore, this benchmark suite aims at bridging the gap between NN4Sys and the verification by using impactful NN4Sys applications as benchmarks to illustrate computer systems’ unique challenges. We also build a compatible version of NN4SysBench, so that today’s verifiers can also work on these benchmarks with approximately the same verification difficulties. The code is available here: https://github.com/Khoury-srg/NN4SysBench.","","2025-03-30 16:21:40","2025-03-30 16:21:40","","","","","","","","","","","","","","","en","","","","","Zotero","","","","/Users/nikolajmosgaardsomod/Zotero/storage/EJPZYPQ3/Lin et al. - NN4SysBench Characterizing Neural Network Verification for Computer Systems.pdf","","","","","","","","","","","","","","","","","","","","","","","","","","","","","","","","","","","","","","","","","","","","","","","","",""
"SAHJD6BL","dataset","2024","Li, Ruohan; Xie, Yiqun; Wang, Dongdong","SolarCube","","","","10.5281/ZENODO.11498739","https://zenodo.org/doi/10.5281/zenodo.11498739","Solar power is a critical source of renewable energy, offering significant potential to lower greenhouse gas emissions and mitigate climate change. However, the cloud induced-variability of solar radiation reaching the earth’s surface presents a challenge for integrating solar power into the grid (e.g., storage and backup management). The new generation of geostationary satellites such as GOES-16 has become an important data source for large-scale and high temporal frequency solar radiation forecasting. However, no machine-learning-ready dataset has integrated geostationary satellite data with fine-grained solar radiation information to support forecasting model development and benchmarking with consistent metrics. We present SolarCube, a new ML-ready benchmark dataset for solar radiation forecasting. SolarCube covers 19 study areas distributed over multiple continents: North America, South America, Asia, and Oceania. The dataset supports short (i.e., 30 minutes to 6 hours) and long-term (i.e., day-ahead or longer) solar radiation forecasting at both point-level (i.e., specific locations of monitoring stations) and area-level, by processing and integrating data from multiple sources, including geostationary satellite images, physics-derived solar radiation, and ground station observations from different monitoring networks over the globe. We also evaluated a set of forecasting models for point- and image-based time-series data to develop performance benchmarks under different testing scenarios. The dataset is available at https://doi.org/10.5281/zenodo.11498739. A Python library is available to conveniently generate different variations of the dataset based on user needs, along with baseline models at https://github.com/Ruohan-Li/SolarCube.","2024-06-12","2025-03-30 16:21:43","2025-03-30 16:21:43","2025-03-30 16:21:43","","","","","","","","","","","","Zenodo","","en","Creative Commons Attribution 4.0 International","","","","DOI.org (Datacite)","","","","/Users/nikolajmosgaardsomod/Zotero/storage/RAQSSFGA/Li et al. - 2024 - SolarCube.pdf","","","","","","","","","","","","","","","","","","","","","","","","","","","","","","","","","","","","","","","","","","","","","","","","",""
